{
  "$schema": "../../../schemas/records/bom-components.schema.json",
  "schema_version": "1.0.0",
  "id": "bompart.part.aurelia_system_controller",
  "record_type": "bom-components",
  "data": {
    "id": "bompart.part.aurelia_system_controller",
    "name": "AION Aurelia system controller (DMA, banking and refresh)",
    "category": "catalog_component",
    "catalog_ref": "part.aurelia_system_controller",
    "manufacturer": "AION Labs",
    "manufacturer_part_number": null,
    "unit_cost": null,
    "currency": null,
    "quote_date": null,
    "quantity_tier": null,
    "qualification_status": "unresolved",
    "requirements": [
      "Qualify CPU bus handover at 4 and 6 MHz, bounded DMA bursts, device-ready waits, completion interrupts and abort/reset recovery.",
      "Verify independent refresh for every installed physical bank, including hidden banks and Aurelia 16 KiB expansion; derive deadlines from qualified DRAM ordering codes.",
      "Freeze package/pinout, external buffers, memory decode, bank-latched DMA addressing and simultaneous video/peripheral stress tests."
    ]
  }
}
