{
  "$schema": "../../../schemas/records/bom-components.schema.json",
  "schema_version": "1.0.0",
  "id": "bompart.computer.aurelia_plus.525_inch_double_density_floppy_mechanism",
  "record_type": "bom-components",
  "data": {
    "id": "bompart.computer.aurelia_plus.525_inch_double_density_floppy_mechanism",
    "name": "525 inch double density floppy mechanism",
    "category": "unresolved_component",
    "catalog_ref": null,
    "manufacturer": null,
    "manufacturer_part_number": null,
    "unit_cost": null,
    "currency": null,
    "quote_date": null,
    "quantity_tier": null,
    "qualification_status": "unresolved",
    "requirements": []
  }
}
