{
  "$schema": "../../../schemas/records/bom-components.schema.json",
  "schema_version": "1.0.0",
  "id": "bompart.device.mono_pro.mono_pro_hv_deflection_psu",
  "record_type": "bom-components",
  "data": {
    "id": "bompart.device.mono_pro.mono_pro_hv_deflection_psu",
    "name": "HV, deflection and mains PSU",
    "category": "catalog_component",
    "catalog_ref": null,
    "manufacturer": null,
    "manufacturer_part_number": null,
    "unit_cost": null,
    "currency": null,
    "quote_date": null,
    "quantity_tier": null,
    "qualification_status": "unresolved",
    "requirements": [
      "Planning allowance; released drawing, sourcing and qualification pending."
    ]
  }
}
