{
  "$schema": "../../../schemas/records/bom-components.schema.json",
  "schema_version": "1.0.0",
  "id": "bompart.device.network_card_aurelia.external_cable_and_regional_mains_packout",
  "record_type": "bom-components",
  "data": {
    "id": "bompart.device.network_card_aurelia.external_cable_and_regional_mains_packout",
    "name": "external cable and regional mains packout",
    "category": "unresolved_component",
    "catalog_ref": null,
    "manufacturer": null,
    "manufacturer_part_number": null,
    "unit_cost": null,
    "currency": null,
    "quote_date": null,
    "quantity_tier": null,
    "qualification_status": "unresolved",
    "requirements": []
  }
}
