{
  "$schema": "../../../schemas/records/bom-components.schema.json",
  "schema_version": "1.0.0",
  "id": "bompart.device.logix_mouse.pcb_mcu_firmware",
  "record_type": "bom-components",
  "data": {
    "id": "bompart.device.logix_mouse.pcb_mcu_firmware",
    "name": "pcb mcu firmware",
    "category": "catalog_component",
    "catalog_ref": null,
    "manufacturer": null,
    "manufacturer_part_number": null,
    "unit_cost": null,
    "currency": null,
    "quote_date": null,
    "quantity_tier": null,
    "qualification_status": "unresolved",
    "requirements": [
      "Mechanical tracking, two buttons, two rollers. Driver/update media and printed quickstart included; Entertainment Suite is a separately costed optional purchase or package component."
    ]
  }
}
