{
  "$schema": "../../../schemas/records/bom-components.schema.json",
  "schema_version": "1.0.0",
  "id": "bompart.device.network_card_artemis.network_controller_framing_crc_and_buffers",
  "record_type": "bom-components",
  "data": {
    "id": "bompart.device.network_card_artemis.network_controller_framing_crc_and_buffers",
    "name": "network controller framing CRC and buffers",
    "category": "unresolved_component",
    "catalog_ref": null,
    "manufacturer": null,
    "manufacturer_part_number": null,
    "unit_cost": null,
    "currency": null,
    "quote_date": null,
    "quantity_tier": null,
    "qualification_status": "unresolved",
    "requirements": [
      "Hardware framing/CRC and address filtering; 4 KiB local packet RAM target, complete-frame credits and packet interrupts. Freeze frame size, RAM organization and chip count; enforce the catalog host rate profile."
    ]
  }
}
