{
  "$schema": "../../../schemas/records/bom-components.schema.json",
  "schema_version": "1.0.0",
  "id": "bompart.part.nec_pc8853_display_assembly",
  "record_type": "bom-components",
  "data": {
    "id": "bompart.part.nec_pc8853_display_assembly",
    "name": "NEC PC-8853 / JC-1410P2-class colour display assembly",
    "category": "catalog_component",
    "catalog_ref": "part.nec_pc8853_display_assembly",
    "manufacturer": null,
    "manufacturer_part_number": null,
    "unit_cost": null,
    "currency": null,
    "quote_date": null,
    "quantity_tier": null,
    "qualification_status": "unresolved",
    "requirements": [
      "Complete NEC-class 14-inch OEM display core, tube/yoke/HV/deflection/PSU; excludes AION adapter and final Logix cabinet. $280 is a volume procurement scenario, not a quote."
    ]
  }
}
