{
  "$schema": "../../../schemas/records/bom-components.schema.json",
  "schema_version": "1.0.0",
  "id": "bompart.computer.aurelia_plus.connectors_passives_fasteners_and_harnesses",
  "record_type": "bom-components",
  "data": {
    "id": "bompart.computer.aurelia_plus.connectors_passives_fasteners_and_harnesses",
    "name": "connectors passives fasteners and harnesses",
    "category": "unresolved_component",
    "catalog_ref": null,
    "manufacturer": null,
    "manufacturer_part_number": null,
    "unit_cost": null,
    "currency": null,
    "quote_date": null,
    "quantity_tier": null,
    "qualification_status": "unresolved",
    "requirements": []
  }
}
