{
  "$schema": "../../../schemas/records/bom-components.schema.json",
  "schema_version": "1.0.0",
  "id": "bompart.device.artemis_video_card_64kb.clock_fifo_transceivers",
  "record_type": "bom-components",
  "data": {
    "id": "bompart.device.artemis_video_card_64kb.clock_fifo_transceivers",
    "name": "clock fifo transceivers",
    "category": "catalog_component",
    "catalog_ref": null,
    "manufacturer": null,
    "manufacturer_part_number": null,
    "unit_cost": null,
    "currency": null,
    "quote_date": null,
    "quantity_tier": null,
    "qualification_status": "unresolved",
    "requirements": [
      "Eight 64Kx1 chips provide 64 KiB as two interleaved 32 KiB 8-bit banks (local 16-bit word mapping); two 2114 chips supply separate 1 KiB sprite SRAM. Timing/bandwidth qualification remains required."
    ]
  }
}
