{
  "$schema": "../../../schemas/records/bom-components.schema.json",
  "schema_version": "1.0.0",
  "id": "bompart.device.mono_monitor_2.video_link_receiver_and_grayscale_amplifier",
  "record_type": "bom-components",
  "data": {
    "id": "bompart.device.mono_monitor_2.video_link_receiver_and_grayscale_amplifier",
    "name": "video link receiver and grayscale amplifier",
    "category": "unresolved_component",
    "catalog_ref": null,
    "manufacturer": null,
    "manufacturer_part_number": null,
    "unit_cost": null,
    "currency": null,
    "quote_date": null,
    "quantity_tier": null,
    "qualification_status": "unresolved",
    "requirements": []
  }
}
