{
  "$schema": "../../../schemas/records/bom-components.schema.json",
  "schema_version": "1.0.0",
  "id": "bompart.part.mono_monitor2_controller",
  "record_type": "bom-components",
  "data": {
    "id": "bompart.part.mono_monitor2_controller",
    "name": "Mono Monitor II custom controller",
    "category": "catalog_component",
    "catalog_ref": "part.mono_monitor2_controller",
    "manufacturer": null,
    "manufacturer_part_number": null,
    "unit_cost": null,
    "currency": null,
    "quote_date": null,
    "quantity_tier": null,
    "qualification_status": "unresolved",
    "requirements": [
      "Locate 16×8-bit palette storage, command decode, DAC and analog output",
      "define clock/raster and custom-silicon parameters."
    ]
  }
}
