{
  "$schema": "../../../schemas/records/bom-components.schema.json",
  "schema_version": "1.0.0",
  "id": "bompart.device.color_pro_14.digital_receiver_pcb",
  "record_type": "bom-components",
  "data": {
    "id": "bompart.device.color_pro_14.digital_receiver_pcb",
    "name": "digital receiver pcb",
    "category": "catalog_component",
    "catalog_ref": null,
    "manufacturer": null,
    "manufacturer_part_number": null,
    "unit_cost": null,
    "currency": null,
    "quote_date": null,
    "quantity_tier": null,
    "qualification_status": "unresolved",
    "requirements": [
      "No second tube/HV/PSU charge. Timing adaptation and final focus/convergence/grayscale tests remain explicit."
    ]
  }
}
